name,rating,reviews_count,category,address,location,hours,website,plus_code,phone
Rock Solid Marble And Granite LLC,4.8,23,Countertop store,"1719 N Main St, Sheffield, MA 01257",N/A,N/A,rocksolidmarbleandgranite.com,"5J2M+WQ Sheffield, Massachusetts",(413) 229-9001
Northern Granite and Marble,5.0,48,Countertop store,"380 Union St Unit 49, West Springfield, MA 01089",N/A,N/A,northerngranitema.com,"492J+9R West Springfield, Massachusetts",(413) 737-8700
Andrew Willey Marble & Granite,3.8,17,Granite supplier,"137 Main St, Lee, MA 01238",N/A,N/A,awmarbleandgranite.com,"8P4X+QR Lee, Massachusetts",(413) 243-0228
"Marble and Granite, Inc.",4.4,14,Wholesaler,"270 University Ave, Westwood, MA 02090",N/A,N/A,marbleandgranite.com,"6R2W+RF Westwood, Massachusetts",(781) 407-9560
Marble and Granite International,5.0,2,Home improvement store,"99 Hammond St, Waltham, MA 02451",N/A,N/A,mgiboston.com,"9QH3+WC Waltham, Massachusetts",(781) 647-1979
