name,rating,reviews_count,category,address,location,hours,website,plus_code,phone
Time To Shine Power Washing & Window Cleaning,5.0,407,Pressure washing service,"1040 Reed Rd Unite 2B, Dartmouth, MA 02747",N/A,N/A,timetoshinepowerwashing.com,"MX77+WP Dartmouth, Massachusetts",(508) 685-5343
Whaling City Pressure Washing,5.0,41,Pressure washing service,"1434 Sassaquin Ave, New Bedford, MA 02745",N/A,N/A,whalingcitypressurewashing.com,"P3P2+X8 New Bedford, Massachusetts",(508) 742-7489
Coastal Power Washing,5.0,N/A,Pressure washing service,"4536 Acushnet Ave, New Bedford, MA 02745",N/A,N/A,N/A,"P3R4+7J New Bedford, Massachusetts",(617) 780-9337
Coastal Power Washing,5.0,N/A,Pressure washing service,"4536 Acushnet Ave, New Bedford, MA 02745",N/A,N/A,N/A,"P3R4+7J New Bedford, Massachusetts",(617) 780-9337
Revolution SoftWash,4.9,119,Pressure washing service,"1134 American Legion Hwy, Westport, MA 02790",N/A,N/A,revolutionsoftwash.com,"JWPW+55 Westport, Massachusetts",(888) 803-7482
Revolution SoftWash,4.9,119,Pressure washing service,"1134 American Legion Hwy, Westport, MA 02790",N/A,N/A,revolutionsoftwash.com,"JWPW+55 Westport, Massachusetts",(888) 803-7482
A to Z Softwash,5.0,106,Pressure washing service,"79 11th St, Onset, MA 02558",N/A,N/A,atozroofclean.com,"P8WQ+J6 Onset, Wareham, MA",(508) 209-7795
A to Z Softwash,5.0,106,Pressure washing service,"79 11th St, Onset, MA 02558",N/A,N/A,atozroofclean.com,"P8WQ+J6 Onset, Wareham, MA",(508) 209-7795
The Powerwash Company,5.0,61,Pressure washing service,"851 Pleasant St, Raynham, MA 02767",N/A,N/A,thepowerwashco.com,"WXPF+FQ Raynham, Massachusetts",(508) 823-9274
The Powerwash Company,5.0,61,Pressure washing service,"851 Pleasant St, Raynham, MA 02767",N/A,N/A,thepowerwashco.com,"WXPF+FQ Raynham, Massachusetts",(508) 823-9274
South Coast Shingle Savers,5.0,18,Pressure washing service,"974 Faunce Corner Rd, Dartmouth, MA 02747",N/A,N/A,southcoastshinglesavers.org,"M2V5+M7 Dartmouth, Massachusetts",(855) 638-7191
South Coast Shingle Savers,5.0,18,Pressure washing service,"974 Faunce Corner Rd, Dartmouth, MA 02747",N/A,N/A,southcoastshinglesavers.org,"M2V5+M7 Dartmouth, Massachusetts",(855) 638-7191
SouthCoast Pressure Wash,5.0,16,Pressure washing service,"47 Wooley St, Fall River, MA 02724",N/A,N/A,southcoastpressurewas.com,"MRQP+FC Fall River, Massachusetts",(508) 567-4782
SouthCoast Pressure Wash,5.0,16,Pressure washing service,"47 Wooley St, Fall River, MA 02724",N/A,N/A,southcoastpressurewas.com,"MRQP+FC Fall River, Massachusetts",(508) 567-4782
Stay Clean Power Washing,5.0,292,Pressure washing service,"28 Rudon Ct, North Attleborough, MA 02760",N/A,N/A,staycleanpowerwashing.com,N/A,(508) 838-4285
Q's Pressure Wash & Paint,5.0,41,Painting,"67 Francis St, Rehoboth, MA 02769",N/A,N/A,qspressurewashing.net,"VQHV+M8 Rehoboth, Massachusetts",(401) 648-7414
Happy Dog Pressure Washing,N/A,N/A,Pressure washing service,"118 Great Neck Rd, Wareham, MA 02571",N/A,N/A,happydogpressurewashing.com,"P8R9+W8 Wareham, Massachusetts",(774) 263-4237
Happy Dog Pressure Washing,N/A,N/A,Pressure washing service,"118 Great Neck Rd, Wareham, MA 02571",N/A,N/A,happydogpressurewashing.com,"P8R9+W8 Wareham, Massachusetts",(774) 263-4237
Flow Bros Pressure Washing,5.0,127,Pressure washing service,"7 Sawyer Pl, Plymouth, MA 02360",N/A,N/A,plymouthpressurewashing.com,"X87H+9Q Plymouth, Massachusetts",(617) 291-9792
Flow Bros Pressure Washing,5.0,127,Pressure washing service,"7 Sawyer Pl, Plymouth, MA 02360",N/A,N/A,plymouthpressurewashing.com,"X87H+9Q Plymouth, Massachusetts",(617) 291-9792
JRH Power Wash & Property Services,5.0,3,Cleaners,"257 Whippoorwill Dr, Raynham, MA 02767",N/A,N/A,N/A,"WXFQ+28 Raynham, Massachusetts",N/A
JRH Power Wash & Property Services,5.0,3,Cleaners,"257 Whippoorwill Dr, Raynham, MA 02767",N/A,N/A,N/A,"WXFQ+28 Raynham, Massachusetts",N/A
Pontes Power Washing Service,5.0,12,Pressure washing service,"74 Foster St, Fall River, MA 02721",N/A,N/A,N/A,"MRQV+JC Fall River, Massachusetts",(508) 567-8910
Pontes Power Washing Service,5.0,12,Pressure washing service,"74 Foster St, Fall River, MA 02721",N/A,N/A,N/A,"MRQV+JC Fall River, Massachusetts",(508) 567-8910
Blue Wave House Wash,5.0,15,Pressure washing service,"10 Shaker Ln, East Falmouth, MA 02536",N/A,N/A,bluewavehousewash.com,"HC5P+RV East Falmouth, Falmouth, MA",(774) 298-0164
PowerShine Roof & Exterior Cleaning,5.0,60,Pressure washing service,"10 Innsbruck Ln, Kingston, MA 02364",N/A,N/A,powershinecleaning.com,"W6QX+V9 Kingston, Massachusetts",(781) 291-1225
Jeff's Power Washing Inc,4.7,13,Pressure washing service,"457 Main St, Bridgewater, MA 02324",N/A,N/A,jeffspowerwashing.com,"X2X7+XP Bridgewater, Massachusetts",(508) 484-3879
Patriot Power Washing,5.0,57,Pressure washing service,"4 Glenn Rd, North Easton, MA 02356",N/A,N/A,mystrikingly.com,"3WF8+FC North Easton, Easton, MA",(508) 208-6494
K W Power Washing & Painting,5.0,4,Painter,"15 Center St, Westport, MA 02790",N/A,N/A,N/A,"JWVM+VR Westport, Massachusetts",(508) 997-2892
K W Power Washing & Painting,5.0,4,Painter,"15 Center St, Westport, MA 02790",N/A,N/A,N/A,"JWVM+VR Westport, Massachusetts",(508) 997-2892
"Celtic Services, Inc Powerwashing",5.0,64,Pressure washing service,"121 Timber Ln Apt B, Marstons Mills, MA 02648",N/A,N/A,celticpowerwashing.com,"MJF9+CG Marstons Mills, Barnstable, MA",(508) 360-0755
Supreme Rinse Pressure Washing LLC,5.0,2,Pressure washing service,"5 Homestead Rd, Middleborough, MA 02346",N/A,N/A,facebook.com,"V4J5+8F Middleborough, Massachusetts",(508) 858-6161
"All Washed Up, Inc.",3.7,3,Pressure washing service,"336 Weir St, Taunton, MA 02780",N/A,N/A,allwashedupinc.com,"VWV5+2R Taunton, Massachusetts",(508) 889-2411
Southeast Softwash LLC,5.0,63,Pressure washing service,"91 Pheasant Ln, Raynham, MA 02767",N/A,N/A,N/A,"WXFM+CP Raynham, Massachusetts",(774) 406-9383
Plainville Power Wash,5.0,16,Pressure washing service,"6 Horseshoe Dr, Plainville, MA 02762",N/A,N/A,plainvillepowerwash.com,"2MG7+R4 Plainville, Massachusetts",(508) 527-4095
Star power wash handyman,N/A,N/A,Pressure washing service,"25 West St, Middleborough, MA 02346",N/A,N/A,N/A,"V3VH+9G Middleborough, Massachusetts",(781) 580-9940
Exclusive Pressure Washing,5.0,25,Pressure washing service,"9 Parker Rd, Pembroke, MA 02359",N/A,N/A,exclusivepressurewash.com,"25XF+6M Pembroke, Massachusetts",(781) 799-6377
Exclusive Pressure Washing,5.0,25,Pressure washing service,"9 Parker Rd, Pembroke, MA 02359",N/A,N/A,exclusivepressurewash.com,"25XF+6M Pembroke, Massachusetts",(781) 799-6377
Gaeta Exterior Services,5.0,87,Pressure washing service,"843 Pike Ave, Attleboro, MA 02703",N/A,N/A,gaetaservices.com,"WQH4+9F Attleboro, Massachusetts",(508) 243-1699
All State Mobile Wash,4.9,41,Pressure washing service,"80 Cross St, Hanover, MA 02339",N/A,N/A,allstatemobilewash.com,"442W+2H Hanover, Massachusetts",(781) 502-6000
Packard Power Washing LLC,5.0,7,Pressure washing service,"67 East St, East Bridgewater, MA 02333",N/A,N/A,N/A,"226Q+VJ East Bridgewater, Massachusetts",(774) 226-5906
"Insta-Brite Mobile Washing, Inc.",4.8,100,Pressure washing service,"500 South Ave, Whitman, MA 02382",N/A,N/A,instabrite.com,"33MJ+Q2 Whitman, Massachusetts",(781) 447-0022
Under Pressure Power Washing Inc.,4.9,1014,Pressure washing service,"88a Elm St, Hopkinton, MA 01748",N/A,N/A,underpressurewash.com,"6F84+Q9 Hopkinton, Massachusetts",(508) 944-6644
One Stop Power Washing,4.3,6,Pressure washing service,"55 Treetop Way, Plymouth, MA 02360",N/A,N/A,onestoppainting.com,"RCPX+86 Plymouth, Massachusetts",(508) 888-3500
Bubble Guy Soft Washing/Pressure Washing/Power Washing & Window Cleaning,5.0,65,Pressure washing service,"119 South St, Plainville, MA 02762",N/A,N/A,bubbleguyllc.com,"2M47+3J Plainville, Massachusetts",(508) 932-9393
One Stop Power Washing,4.3,6,Pressure washing service,"55 Treetop Way, Plymouth, MA 02360",N/A,N/A,onestoppainting.com,"RCPX+86 Plymouth, Massachusetts",(508) 888-3500
Curb Appeal Power Wash-Soft Wash & Gutter Cleaning,5.0,77,Pressure washing service,"277 Foster Rd, Tewksbury, MA 01876",N/A,N/A,curbappeal978.com,"HQRG+QC Tewksbury, Massachusetts",(978) 876-0461
Curb Appeal Power Wash-Soft Wash & Gutter Cleaning,5.0,77,Pressure washing service,"277 Foster Rd, Tewksbury, MA 01876",N/A,N/A,curbappeal978.com,"HQRG+QC Tewksbury, Massachusetts",(978) 876-0461
Big Boss Softwash,5.0,4,Pressure washing service,"82 Prudence Ln, Cotuit, MA 02635",N/A,N/A,bigbosscleans.com,N/A,(774) 836-5545
Eagle Wash,4.0,8,Pressure washing service,"746 Main St, Osterville, MA 02655",N/A,N/A,eaglecapecod.com,"JJH8+6X Osterville, Barnstable, MA",(508) 428-0053
"Advanced Home Services, LLC",5.0,11,Pressure washing service,"10 Regent Rd, Wrentham, MA 02093",N/A,N/A,ahspowerwash.com,"3M3P+Q7 Wrentham, Massachusetts",(508) 384-7378
Like New Home Services LLC,5.0,24,Pressure washing service,"409 Canton St Unit 4, Stoughton, MA 02072",N/A,N/A,N/A,"4VHM+J5 Stoughton, Massachusetts",N/A
Eagle Wash,4.0,8,Pressure washing service,"746 Main St, Osterville, MA 02655",N/A,N/A,eaglecapecod.com,"JJH8+6X Osterville, Barnstable, MA",(508) 428-0053
"Advanced Home Services, LLC",5.0,11,Pressure washing service,"10 Regent Rd, Wrentham, MA 02093",N/A,N/A,ahspowerwash.com,"3M3P+Q7 Wrentham, Massachusetts",(508) 384-7378
Like New Home Services LLC,5.0,24,Pressure washing service,"409 Canton St Unit 4, Stoughton, MA 02072",N/A,N/A,N/A,"4VHM+J5 Stoughton, Massachusetts",N/A
Like New Home Services LLC,5.0,24,Pressure washing service,"409 Canton St Unit 4, Stoughton, MA 02072",N/A,N/A,N/A,"4VHM+J5 Stoughton, Massachusetts",N/A
