name,rating,reviews_count,category,address,location,hours,website,plus_code,phone
Northern Granite and Marble,5.0,48,Countertop store,"380 Union St Unit 49, West Springfield, MA 01089",N/A,N/A,northerngranitema.com,"492J+9R West Springfield, Massachusetts",(413) 737-8700
Santo C. DeSpirt Marble & Granite,4.9,45,Granite supplier,"44 N Ramah Cir, Agawam, MA 01001",N/A,N/A,santocdespirt.com,"39P9+W7 Agawam, Massachusetts",(413) 786-7073
Rock Solid Marble And Granite LLC,4.8,23,Countertop store,"1719 N Main St, Sheffield, MA 01257",N/A,N/A,rocksolidmarbleandgranite.com,"5J2M+WQ Sheffield, Massachusetts",(413) 229-9001
D & C Granite & Marble,5.0,9,Granite supplier,"664 Center St, Ludlow, MA 01056",N/A,N/A,dcgraniteandmarble.net,"5GJJ+84 Ludlow, Massachusetts",(413) 583-3399
Bannon & Ferrari Granite,5.0,66,Granite supplier,"874 Berkshire Ave, Indian Orchard, MA 01151",N/A,N/A,bannonferrarigranite.com,"4FVG+8P Indian Orchard, Springfield, MA",(413) 543-5231
"Marble and Granite, Inc.",4.4,14,Wholesaler,"270 University Ave, Westwood, MA 02090",N/A,N/A,marbleandgranite.com,"6R2W+RF Westwood, Massachusetts",(781) 407-9560
Granite Creations,4.5,22,Granite supplier,"2376 Boston Rd, Wilbraham, MA 01095",N/A,N/A,granitecreationsma.com,"5G2W+57 Wilbraham, Massachusetts",(413) 596-3144
"New England Custom Countertops, Inc.",4.8,12,Countertop store,"Green Building Behind House, 7 S Maple St, Westfield, MA 01085",N/A,N/A,newenglandcustomcountertops.com,"467W+MG Westfield, Massachusetts",(413) 568-0100
Quality Granite and Quartz Llc,4.6,30,Granite supplier,"357 Shaker Rd, East Longmeadow, MA 01028",N/A,N/A,qualitygraniteandquartz.com,"2FWH+RW East Longmeadow, Massachusetts",(413) 381-2838
J&J GRANITE INC,4.9,32,Countertop store,"940 Boston Rd, Springfield, MA 01119",N/A,N/A,jjgranitema.com,"4FQP+7P Springfield, Massachusetts",(774) 578-8781
