name,rating,reviews_count,category,address,location,hours,website,plus_code,phone
Northern Granite and Marble,5.0,48,Countertop store,"380 Union St Unit 49, West Springfield, MA 01089",N/A,N/A,northerngranitema.com,"492J+9R West Springfield, Massachusetts",(413) 737-8700
Santo C. DeSpirt Marble & Granite,4.9,45,Granite supplier,"44 N Ramah Cir, Agawam, MA 01001",N/A,N/A,santocdespirt.com,"39P9+W7 Agawam, Massachusetts",(413) 786-7073
"Marble and Granite, Inc.",4.4,14,Wholesaler,"270 University Ave, Westwood, MA 02090",N/A,N/A,marbleandgranite.com,"6R2W+RF Westwood, Massachusetts",(781) 407-9560
Quality Granite and Quartz Llc,4.6,30,Granite supplier,"357 Shaker Rd, East Longmeadow, MA 01028",N/A,N/A,qualitygraniteandquartz.com,"2FWH+RW East Longmeadow, Massachusetts",(413) 381-2838
StoneOne Marble & Granite,4.4,63,Countertop store,"75 Mystic St, Methuen, MA 01844",N/A,N/A,stoneonecorp.com,"PQGX+P3 Methuen, Massachusetts",(978) 681-7664
