name,rating,reviews_count,category,address,location,hours,website,plus_code,phone
AM Pro Wash,5.0,300,Pressure washing service,"8 Townsend St, Pepperell, MA 01463",N/A,N/A,amprowash.com,"MC82+Q9 Pepperell, Massachusetts",(978) 800-2050
East Coast Power Washing,4.2,37,Pressure washing service,"58 Tyngsboro Rd, Westford, MA 01886",N/A,N/A,eastcoastwash.com,"JHJ6+66 Westford, Massachusetts",(978) 996-0116
North Central Power Washing,5.0,32,Pressure washing service,"44 Union St, Leominster, MA 01453",N/A,N/A,northcentralpowerwashing.com,"G6CQ+JW Leominster, Massachusetts",(508) 274-4097
Curb Appeal Power Wash-Soft Wash & Gutter Cleaning,5.0,77,Pressure washing service,"277 Foster Rd, Tewksbury, MA 01876",N/A,N/A,curbappeal978.com,"HQRG+QC Tewksbury, Massachusetts",(978) 876-0461
Curb Appeal Power Wash-Soft Wash & Gutter Cleaning,5.0,77,Pressure washing service,"277 Foster Rd, Tewksbury, MA 01876",N/A,N/A,curbappeal978.com,"HQRG+QC Tewksbury, Massachusetts",(978) 876-0461
AMCO Power Washing,5.0,N/A,Cleaners,"7 Suomi Rd, Gardner, MA 01440",N/A,N/A,amcopowerwashing.com,"HXJQ+VW Gardner, Massachusetts",(978) 696-6394
