name,rating,reviews_count,category,address,location,hours,website,plus_code,phone
Nextgen Roofing,5.0,319,Roofing contractor,"1 Arch Rd Suite 11, Westfield, MA 01085",N/A,N/A,nextgen413.net,"47V6+2X Westfield, Massachusetts",(413) 613-4052
"CDA Roofing & Siding Contractors, LLC",4.4,44,Roofing contractor,"1775 Main St, Agawam, MA 01001",N/A,N/A,cdaroofing.net,"29MM+5C Agawam, Massachusetts",(413) 786-4081
C D Roofing Contractor,3.0,2,Roofing contractor,"279 Garden St, Feeding Hills, MA 01030",N/A,N/A,N/A,"387W+4R Feeding Hills, Agawam, MA",(413) 786-4081
Mahan Slate Roofing Co.,5.0,3,Roofing contractor,"699 Silver St, Agawam, MA 01001",N/A,N/A,mahanslate.com,"383X+99 Agawam, Massachusetts",(800) 347-9529
Sky Tech Roofing Inc,5.0,2,Roofing contractor,"Westfield, MA 01086",N/A,N/A,skytechroof.com,N/A,(413) 562-0528
