name,rating,reviews_count,category,address,location,hours,website,plus_code,phone
Dupee Flooring,5.0,5,Flooring contractor,"33 Orchard Hill Dr, North Adams, MA 01247",N/A,N/A,dupeeflooring.com,"MWR9+P7 North Adams, Massachusetts",(413) 663-8936
Ernie's Floor Sanding Inc,5.0,6,Contractor,"471 E Main St, North Adams, MA 01247",N/A,N/A,N/A,"MWX3+P2 North Adams, Massachusetts",(413) 664-9670
Cape Cod Hardwood Floors since 1988,5.0,23,Wood floor refinishing service,"508 Carriage Shop Rd, East Falmouth, MA 02536",N/A,N/A,N/A,"JFQ6+3Q East Falmouth, Falmouth, MA",(508) 364-1650
Floor & Decor,4.3,507,Flooring store,"80 Stockwell Dr, Avon, MA 02322",N/A,Closed ⋅ Opens 7AM WedSee more hours,flooranddecor.com,"4WMM+3F Avon, Massachusetts",(508) 513-1434
FLOORS & WALLS,3.1,23,Flooring store,"379 Iyannough Rd, Hyannis, MA 02601",Located in: Airport Shopping Center,N/A,floorswalls.com,"MP78+3Q Hyannis, Barnstable, MA",(508) 419-6500
